{
  "schemaVersion": "1.0",
  "sessionId": "forge-session-20260712-035106",
  "sessionDate": "2026-07-12",
  "phase": {
    "identifier": "REVIEW_REQUIRED",
    "title": "REVIEW_REQUIRED",
    "status": "incomplete"
  },
  "objective": {
    "startingObjective": "REVIEW_REQUIRED",
    "endingObjective": "REVIEW_REQUIRED"
  },
  "repository": {
    "head": "58b4b4246ea3d71034e9419aedf6893cf5478d7e",
    "originMain": "58b4b4246ea3d71034e9419aedf6893cf5478d7e",
    "branch": "main",
    "workingTreeClean": false,
    "implementationCommit": null,
    "governanceCommit": null
  },
  "work": {
    "delivered": [],
    "modifiedFiles": [
      "docs/architecture/synchronized/FORGE_SYNC_CONTROL_CENTER.md",
      "docs/architecture/synchronized/FORGE_SYNC_SESSION.md",
      "docs/architecture/synchronized/FORGE_SYNC_STATUS.md",
      "governance/state/current-governance-state.json",
      "scripts/governance/collectSessionEvidence.mjs",
      "scripts/governance/generateGovernanceState.mjs"
    ],
    "knownWarnings": []
  },
  "validation": {
    "focusedTests": {
      "status": "not-run",
      "command": null,
      "summary": null
    },
    "fullTests": {
      "status": "not-run",
      "command": null,
      "summary": null
    },
    "productionBuild": {
      "status": "not-run",
      "command": null,
      "summary": null
    }
  },
  "completion": {
    "workComplete": false,
    "supportedByEvidence": false,
    "incompleteReason": "The repository evidence collector does not infer session completion. Human review is required."
  },
  "nextSession": {
    "objective": "REVIEW_REQUIRED",
    "startingInspection": "REVIEW_REQUIRED"
  },
  "evidence": {
    "capturedAt": "2026-07-12T08:51:06.714Z",
    "latestCommit": {
      "hash": "58b4b4246ea3d71034e9419aedf6893cf5478d7e",
      "subject": "Complete deterministic shadow governance synchronization",
      "committedAt": "2026-07-12T03:23:56-05:00"
    },
    "headMatchesOriginMain": true,
    "gitStatus": [
      " M docs/architecture/synchronized/FORGE_SYNC_CONTROL_CENTER.md",
      " M docs/architecture/synchronized/FORGE_SYNC_SESSION.md",
      " M docs/architecture/synchronized/FORGE_SYNC_STATUS.md",
      " M governance/state/current-governance-state.json",
      " M scripts/governance/collectSessionEvidence.mjs",
      "?? scripts/governance/generateGovernanceState.mjs"
    ]
  }
}
