{
  "schemaVersion": "1.0",
  "sessionId": "forge-session-20260712-195727",
  "sessionDate": "2026-07-12",
  "phase": {
    "identifier": "REVIEW_REQUIRED",
    "title": "REVIEW_REQUIRED",
    "status": "incomplete"
  },
  "objective": {
    "startingObjective": "REVIEW_REQUIRED",
    "endingObjective": "REVIEW_REQUIRED"
  },
  "repository": {
    "head": "ca5dafa81788e3a638c5a8d103301a4594115fab",
    "originMain": "ca5dafa81788e3a638c5a8d103301a4594115fab",
    "branch": "main",
    "workingTreeClean": true,
    "implementationCommit": null,
    "governanceCommit": null
  },
  "work": {
    "delivered": [],
    "modifiedFiles": [],
    "knownWarnings": []
  },
  "validation": {
    "focusedTests": {
      "status": "not-run",
      "command": null,
      "summary": null
    },
    "fullTests": {
      "status": "not-run",
      "command": null,
      "summary": null
    },
    "productionBuild": {
      "status": "not-run",
      "command": null,
      "summary": null
    }
  },
  "completion": {
    "workComplete": false,
    "supportedByEvidence": false,
    "incompleteReason": "The repository evidence collector does not infer session completion. Human review is required."
  },
  "nextSession": {
    "objective": "REVIEW_REQUIRED",
    "startingInspection": "REVIEW_REQUIRED"
  },
  "evidence": {
    "capturedAt": "2026-07-13T00:57:27.052Z",
    "latestCommit": {
      "hash": "ca5dafa81788e3a638c5a8d103301a4594115fab",
      "subject": "Add deterministic objective recommendation engine",
      "committedAt": "2026-07-12T19:56:11-05:00"
    },
    "headMatchesOriginMain": true,
    "gitStatus": []
  }
}
